{
  "apiVersion": "v1",
  "presentations": [
    "full",
    "canonical"
  ],
  "includes": [
    "structure",
    "boundaries",
    "provenance",
    "resolution"
  ],
  "observerPresets": [
    {
      "id": "kisurra",
      "longitude": 45.481
    }
  ],
  "reverse": {
    "status": "implemented",
    "endpoint": "/v1/reverse",
    "requiresCompleteTuple": true
  }
}
